DOI;Title;Abstract;Year;Month;Journal;Authors;Cite;Pub_Date
10.1016/j.eimce.2022.12.009;Recommendations of the Spanish Antibiogram Committee (COESANT) for in vitro susceptibility testing of antimicrobial agents by disk diffusion.;Disk diffusion is a well standardized method that provides reliable categorical results to guide antimicrobial therapy in numerous types of infections. Based on the guidelines of the European Committee on Antimicrobial Susceptibility Testing (EUCAST), which are widely implemented in Spain, the Spanish Antibiogram Committee (COESANT) has drawn up recommendations for antimicrobial selection by the disk diffusion technique, including selective reporting and its use for the detection of resistance mechanisms. Factors affecting disk diffusion results, along with advantages and shortcomings of the method, are also discussed.;2023;Nov;Enfermedades infecciosas y microbiologia clinica (English ed.);"Rivera A; Viñado B; Benito N; Docobo-Pérez F; Fernández-Cuenca F; Fernández-Domínguez J; Guinea J; López-Navas A; Moreno MÁ; Larrosa MN; Oliver A; Navarro F";"Rivera A; Viñado B; Benito N; Docobo-Pérez F; Fernández-Cuenca F; Fernández-Domínguez J; Guinea J; López-Navas A; Moreno MÁ; Larrosa MN; Oliver A; Navarro F. Recommendations of the Spanish Antibiogram Committee (COESANT) for in vitro susceptibility testing of antimicrobial agents by disk diffusion.. Enfermedades infecciosas y microbiologia clinica (English ed.). 2023;Nov.";2023-Nov
10.1016/j.farma.2024.07.010;National Survey and consensus document on dosing strategies for beta-lactam antibiotics against multidrug-resistant gram-negative bacilli (MDR-GNB) in critically ill patients undergoing extracorporeal life support techniques: The DOSEBL study protocol.;Infections caused by multidrug-resistant gram-negative bacilli (MDR-GNB) in critically ill patients present a challenge for timely and appropriate antibiotic treatment. This is particularly important in patients undergoing extracorporeal life support techniques such as renal replacement therapy and extracorporeal membrane oxygenation. These techniques can introduce additional pharmacokinetic alterations, potentially leading to suboptimal exposure to antibiotics. This study aims to outline dosing strategies and therapeutic drug monitoring protocols for new β-lactam antibiotics effective against MDR-GNB in critically ill patients undergoing extracorporeal life support techniques at a national level. Additionally, the study seeks to develop a consensus document, based on available evidence. The project will comprise two main phases: I) A national survey, and II) the development of a consensus document. This consensus document, undertaken according to ACCORD guidelines, will encompass: a) establishment of a multidisciplinary panel of experts, b) prospective registration of the consensus, c) evidence synthesis, d) modified Delphi rounds. The antimicrobials to be included will be: meropenem, ceftazidime/avibactam, ceftolozane/tazobactam, cefiderocol, meropenem/vaborbactam, imipenem/relebactam, and aztreonam. Extracorporeal life support techniques will include continuous renal replacement therapy, conventional intermittent hemodialysis, and extracorporeal membrane oxygenation. The availability of extracorporeal life support techniques has expanded significantly in recent years, alongside a rise in the prevalence of infections caused by multidrug-resistant gram-negative bacilli (MDR-GNB). There is a need to develop evidence-based tools of high quality to standardize dosing and monitoring strategies for new β-lactam antibiotics.;2024;Sep;Farmacia hospitalaria : organo oficial de expresion cientifica de la Sociedad Espanola de Farmacia Hospitalaria;"Pau-Parra A; Núñez-Núñez M; Sadyrbaeva-Dolgova S; Doménech Moral L; Campelo Sánchez E; Periañez Parraga LDM; Saeed Khan K; Luque Pardos S";"Pau-Parra A; Núñez-Núñez M; Sadyrbaeva-Dolgova S; Doménech Moral L; Campelo Sánchez E; Periañez Parraga LDM; Saeed Khan K; Luque Pardos S. National Survey and consensus document on dosing strategies for beta-lactam antibiotics against multidrug-resistant gram-negative bacilli (MDR-GNB) in critically ill patients undergoing extracorporeal life support techniques: The DOSEBL study protocol.. Farmacia hospitalaria : organo oficial de expresion cientifica de la Sociedad Espanola de Farmacia Hospitalaria. 2024;Sep.";2024-Sep
10.1016/j.ijantimicag.2023.107016;Effectiveness and safety of bictegravir/emtricitabine/tenofovir alafenamide in HIV late presenters.;"The efficacy of BIC/FTC/TAF in HIV late presenters initiating antiretroviral therapy (ART) has not been sufficiently evaluated. The aim of this study was to assess the effectiveness and tolerability of BIC/FTC/TAF compared to other first-line antiretroviral regimens in treatment-naïve adult individuals from the CoRIS Cohort starting ART with CD4 counts <200 cells/mm3 and/or AIDS-defining conditions between January 1st 2019 and November 30th 2020. Logistic regression models were used to estimate odds ratios (ORs) of association between initial regimen and achievement of viral suppression (VS) (primary objective), defined as HIV RNA <50 cop/mL, and immunological recovery (IR) (secondary objective), defined as CD4 count >200 cells/mm3, at weeks 24 and 48 after initiation of ART. We evaluated 314 individuals (84.7% men, median age 40 years). Of them, 158 initiated with BIC/FTC/TAF. At inclusion, 117 had an AIDS-defining condition. In multivariable analyses, individuals with AIDS-defining conditions initiating ART with BIC/FTC/TAF achieved higher rates of VS at 24 weeks than other regimens (aOR: 0.2; 95% CI: 0.06-0.64) and, at 48 weeks, than DTG/ABC/3TC (aOR: 0.06; 95% CI: 0.01-0.76) and DTG + TDF/3TC (aOR: 0.2; 95% CI: 0.47-0.9). No other differences in VS or IR were observed. At 24 and 48 weeks after ART initiation, treatment discontinuations were lower with BIC/FTC/TAF than with other regimens (3.2% and 7.6% vs. 24.4% and 37.8%, respectively; P < 0.005). Our results suggest that BIC/FTC/TAF could be a preferred regimen as initial therapy in HIV late presenters because of its high effectiveness and good tolerability.";2024;Jan;International journal of antimicrobial agents;"Corona D; Pérez-Valero I; Camacho A; Gutiérrez Liarte Á; Montero-Alonso M; Alemán MR; Ruiz-Seco P; Pérez González A; Riera M; Jarrin I; Rivero-Juárez A; Rivero A";"Corona D; Pérez-Valero I; Camacho A; Gutiérrez Liarte Á; Montero-Alonso M; Alemán MR; Ruiz-Seco P; Pérez González A; Riera M; Jarrin I; Rivero-Juárez A; Rivero A. Effectiveness and safety of bictegravir/emtricitabine/tenofovir alafenamide in HIV late presenters.. International journal of antimicrobial agents. 2024;Jan.";2024-Jan
10.1016/j.ijantimicag.2024.107150;Activity of cefiderocol and innovative β-lactam/β-lactamase inhibitor combinations against isogenic strains of Escherichia coli expressing single and double β-lactamases under high and low permeability conditions.;To analyse the impact of the most clinically relevant β-lactamases and their interplay with low outer membrane permeability on the activity of cefiderocol, ceftazidime/avibactam, aztreonam/avibactam, cefepime/enmetazobactam, cefepime/taniborbactam, cefepime/zidebactam, imipenem/relebactam, meropenem/vaborbactam, meropenem/xeruborbactam and meropenem/nacubactam against recombinant Escherichia coli strains. We constructed 82 E. coli laboratory transformants expressing the main β-lactamases circulating in Enterobacterales (70 expressing single β-lactamase and 12 producing double carbapenemase) under high (E. coli TG1) and low (E. coli HB4) permeability conditions. Antimicrobial susceptibility testing was determined by reference broth microdilution. Aztreonam/avibactam, cefepime/zidebactam, cefiderocol, meropenem/xeruborbactam and meropenem/nacubactam were active against all E. coli TG1 transformants. Imipenem/relebactam, meropenem/vaborbactam, cefepime/taniborbactam and cefepime/enmetazobactam were also highly active, but unstable against most of MBL-producing transformants. Combination of β-lactamases with porin deficiency (E. coli HB4) did not significantly affect the activity of aztreonam/avibactam, cefepime/zidebactam, cefiderocol or meropenem/nacubactam, but limited the effectiveness of the rest of carbapenem- and cefepime-based combinations. Double-carbapenemase production resulted in the loss of activity of most of the compounds tested, an effect particularly evident for those E. coli HB4 transformants in which MBLs were present. Our findings highlight the promising activity that cefiderocol and new β-lactam/β-lactamase inhibitors have against recombinant E. coli strains expressing widespread β-lactamases, including when these are combined with low permeability or other enzymes. Aztreonam/avibactam, cefiderocol, cefepime/zidebactam and meropenem/nacubactam will help to mitigate to some extent the urgency of new compounds able to resist MBL action, although NDM enzymes represent a growing challenge against which drug development efforts are still needed.;2024;May;International journal of antimicrobial agents;"Blanco-Martín T; Alonso-García I; González-Pinto L; Outeda-García M; Guijarro-Sánchez P; López-Hernández I; Pérez-Vázquez M; Aracil B; López-Cerero L; Fraile-Ribot P; Oliver A; Vázquez-Ucha JC; Beceiro A; Bou G; Arca-Suárez J";"Blanco-Martín T; Alonso-García I; González-Pinto L; Outeda-García M; Guijarro-Sánchez P; López-Hernández I; Pérez-Vázquez M; Aracil B; López-Cerero L; Fraile-Ribot P; Oliver A; Vázquez-Ucha JC; Beceiro A; Bou G; Arca-Suárez J. Activity of cefiderocol and innovative β-lactam/β-lactamase inhibitor combinations against isogenic strains of Escherichia coli expressing single and double β-lactamases under high and low permeability conditions.. International journal of antimicrobial agents. 2024;May.";2024-May
10.1016/j.ijantimicag.2024.107161;Synergistic effects of inhaled aztreonam plus tobramycin on hypermutable cystic fibrosis Pseudomonas aeruginosa isolates in a dynamic biofilm model evaluated by mechanism-based modelling and whole genome sequencing.;Hypermutable Pseudomonas aeruginosa strains are highly prevalent in chronic lung infections of patients with cystic fibrosis (CF). Acute exacerbations of these infections have limited treatment options. This study aimed to investigate inhaled aztreonam and tobramycin against clinical hypermutable P. aeruginosa strains using the CDC dynamic in vitro biofilm reactor (CBR), mechanism-based mathematical modelling (MBM) and genomic studies. Two CF multidrug-resistant strains were investigated in a 168 h CBR (n = 2 biological replicates). Regimens were inhaled aztreonam (75 mg 8-hourly) and tobramycin (300 mg 12-hourly) in monotherapies and combination. The simulated pharmacokinetic profiles of aztreonam and tobramycin (t1/2 = 3 h) were based on published lung fluid concentrations in patients with CF. Total viable and resistant counts were determined for planktonic and biofilm bacteria. MBM of total and resistant bacterial counts and whole genome sequencing were completed. Both isolates showed reproducible bacterial regrowth and resistance amplification for the monotherapies by 168 h. The combination performed synergistically, with minimal resistant subpopulations compared to the respective monotherapies at 168 h. Mechanistic synergy appropriately described the antibacterial effects of the combination regimen in the MBM. Genomic analysis of colonies recovered from monotherapy regimens indicated noncanonical resistance mechanisms were likely responsible for treatment failure. The combination of aztreonam and tobramycin was required to suppress the regrowth and resistance of planktonic and biofilm bacteria in all biological replicates of both hypermutable multidrug-resistant P. aeruginosa CF isolates. The developed MBM could be utilised for future investigations of this promising inhaled combination.;2024;Jun;International journal of antimicrobial agents;"Breen SKJ; Harper M; López-Causapé C; Rogers KE; Tait JR; Smallman TR; Lang Y; Lee WL; Zhou J; Zhang Y; Bulitta JB; Nation RL; Oliver A; Boyce JD; Landersdorfer CB";"Breen SKJ; Harper M; López-Causapé C; Rogers KE; Tait JR; Smallman TR; Lang Y; Lee WL; Zhou J; Zhang Y; Bulitta JB; Nation RL; Oliver A; Boyce JD; Landersdorfer CB. Synergistic effects of inhaled aztreonam plus tobramycin on hypermutable cystic fibrosis Pseudomonas aeruginosa isolates in a dynamic biofilm model evaluated by mechanism-based modelling and whole genome sequencing.. International journal of antimicrobial agents. 2024;Jun.";2024-Jun
10.1016/j.ijantimicag.2024.107264;"Corrigendum to ""Activity of cefiderocol and innovative β-lactam/β-lactamase inhibitor combinations against isogenic strains of Escherichia coli expressing single and double β-lactamases under high and low permeability conditions"" [International Journal of Antimicrobial Agents Volume 63, Issue 5 (2024) 107150].";;2024;Aug;International journal of antimicrobial agents;"Blanco-Martín T; Alonso-García I; González-Pinto L; Outeda-García M; Guijarro-Sánchez P; López-Hernández I; Pérez-Vázquez M; Aracil B; López-Cerero L; Fraile-Ribot P; Oliver A; Vázquez-Ucha JC; Beceiro A; Bou G; Arca-Suárez J";"Blanco-Martín T; Alonso-García I; González-Pinto L; Outeda-García M; Guijarro-Sánchez P; López-Hernández I; Pérez-Vázquez M; Aracil B; López-Cerero L; Fraile-Ribot P; Oliver A; Vázquez-Ucha JC; Beceiro A; Bou G; Arca-Suárez J. Corrigendum to ""Activity of cefiderocol and innovative β-lactam/β-lactamase inhibitor combinations against isogenic strains of Escherichia coli expressing single and double β-lactamases under high and low permeability conditions"" [International Journal of Antimicrobial Agents Volume 63, Issue 5 (2024) 107150].. International journal of antimicrobial agents. 2024;Aug.";2024-Aug
10.1016/j.jhin.2024.05.020;Risk factors and clinical impact of multidrug resistance in healthcare-associated bacteraemic urinary tract infections: a post-hoc analysis of a multicentre prospective cohort in Spain.;"The global burden associated with antimicrobial resistance is of increasing concern. To evaluate risk factors associated with multidrug-resistant (MDR) infection and its clinical impact in a cohort of patients with healthcare-associated bacteraemic urinary tract infections (BUTIs). This was a prospective, multicentre, post-hoc analysis of patients with healthcare-associated-BUTI (ITUBRAS-2). The primary outcome was MDR profile. Secondary outcomes were clinical response (at 48-72 h and at hospital discharge) and length of hospital stay from onset of BUTI. Logistic regression was used to evaluate variables associated with MDR profile and clinical response. Length of hospital stay was evaluated using multivariate median regression. In all, 443 episodes were included, of which 271 (61.17%) were classified as expressing an MDR profile. In univariate analysis, MDR profile was associated with E. coli episodes (odds ratio (OR): 3.13; 95% confidence interval (CI): 2.11-4.69, P < 0.001) and the extensively drug-resistant (XDR) pattern with P. aeruginosa aetiology (7.84; 2.37-25.95; P = 0.001). MDR was independently associated with prior use of fluoroquinolones (adjusted OR: 2.43; 95% CI: 1.25-4.69), cephalosporins (2.14; 1.35-3.41), and imipenem or meropenem (2.08; 1.03-4.20) but not with prior ertapenem. In terms of outcomes, MDR profile was not associated with lower frequency of clinical cure, but was associated with longer hospital stay. MDR profile was independently associated with prior use of fluoroquinolones, cephalosporins, imipenem, and meropenem, but not with prior ertapenem. MDR-BUTI episodes were not associated with worse clinical cure, although they were independently associated with longer duration of hospital stay.";2024;Sep;The Journal of hospital infection;"Gómez-Zorrilla S; Becerra-Aparicio F; Sendra E; Zamorano L; Grau I; Pintado V; Padilla B; Benito N; Boix-Palop L; Fariñas MC; Peñaranda M; Gamallo MR; Martinez JA; Morte-Romea E; Del Pozo JL; López Montesinos I; Durán-Jordà X; Ponz R; Cotarelo M; Cantón R; Oliver A; Ruiz-Garbajosa P; Horcajada JP";"Gómez-Zorrilla S; Becerra-Aparicio F; Sendra E; Zamorano L; Grau I; Pintado V; Padilla B; Benito N; Boix-Palop L; Fariñas MC; Peñaranda M; Gamallo MR; Martinez JA; Morte-Romea E; Del Pozo JL; López Montesinos I; Durán-Jordà X; Ponz R; Cotarelo M; Cantón R; Oliver A; Ruiz-Garbajosa P; Horcajada JP. Risk factors and clinical impact of multidrug resistance in healthcare-associated bacteraemic urinary tract infections: a post-hoc analysis of a multicentre prospective cohort in Spain.. The Journal of hospital infection. 2024;Sep.";2024-Sep
10.1016/j.lanepe.2023.100736;Pseudomonas aeruginosa antibiotic susceptibility profiles, genomic epidemiology and resistance mechanisms: a nation-wide five-year time lapse analysis.;Pseudomonas aeruginosa healthcare-associated infections are one of the top antimicrobial resistance threats world-wide. In order to analyze the current trends, we performed a Spanish nation-wide high-resolution analysis of the susceptibility profiles, the genomic epidemiology and the resistome of P. aeruginosa over a five-year time lapse. A total of 3.180 nonduplicated P. aeruginosa clinical isolates from two Spanish nation-wide surveys performed in October 2017 and 2022 were analyzed. MICs of 13 antipseudomonals were determined by ISO-EUCAST. Multidrug resistance (MDR)/extensively drug resistance (XDR)/difficult to treat resistance (DTR)/pandrug resistance (PDR) profiles were defined following established criteria. All XDR/DTR isolates were subjected to whole genome sequencing (WGS). A decrease in resistance to all tested antibiotics, including older and newer antimicrobials, was observed in 2022 vs 2017. Likewise, a major reduction of XDR (15.2% vs 5.9%) and DTR (4.2 vs 2.1%) profiles was evidenced, and even more patent among ICU isolates [XDR (26.0% vs 6.0%) and DTR (8.9% vs 2.6%)] (p < 0.001). The prevalence of Extended-spectrum β-lactamase/carbapenemase production was slightly lower in 2022 (2.1%. vs 3.1%, p = 0.064). However, there was a significant increase in the proportion of carbapenemase production among carbapenem-resistant strains (29.4% vs 18.1%, p = 0.0246). While ST175 was still the most frequent clone among XDR, a slight reduction in its prevalence was noted (35.9% vs 45.5%, p = 0.106) as opposed to ST235 which increased significantly (24.3% vs 12.3%, p = 0.0062). While the generalized decrease in P. aeruginosa resistance, linked to a major reduction in the prevalence of XDR strains, is encouraging, the negative counterpart is the increase in the proportion of XDR strains producing carbapenemases, associated to the significant advance of the concerning world-wide disseminated hypervirulent high-risk clone ST235. Continued high-resolution surveillance, integrating phenotypic and genomic data, is necessary for understanding resistance trends and analyzing the impact of national plans on antimicrobial resistance. MSD and the Instituto de Salud Carlos III, Ministerio de Ciencia e Innovación and Unión Europea-NextGenerationEU.;2023;Nov;The Lancet regional health. Europe;"Sastre-Femenia MÀ; Fernández-Muñoz A; Gomis-Font MA; Taltavull B; López-Causapé C; Arca-Suárez J; Martínez-Martínez L; Cantón R; Larrosa N; Oteo-Iglesias J; Zamorano L; Oliver A";"Sastre-Femenia MÀ; Fernández-Muñoz A; Gomis-Font MA; Taltavull B; López-Causapé C; Arca-Suárez J; Martínez-Martínez L; Cantón R; Larrosa N; Oteo-Iglesias J; Zamorano L; Oliver A. Pseudomonas aeruginosa antibiotic susceptibility profiles, genomic epidemiology and resistance mechanisms: a nation-wide five-year time lapse analysis.. The Lancet regional health. Europe. 2023;Nov.";2023-Nov
10.1016/j.mimet.2023.106694;Are GES carbapenemases underdiagnosed? An allelic discrimination assay for their accurate detection and differentiation.;"GES (Guiana Extended Spectrum) carbapenemases belong to ""minor class A carbapenemases"" and its prevalence could be underestimated due to the lack of specific tests. The aim of this study was to develop an easy PCR method to differentiate between GES β-lactamases with or without carbapenemase activity, based on an allelic discrimination system of SNPs that encode E104K and G170S mutations, without need of sequencing. Two pair of primers and Affinity Plus probes, labeled with different fluorophores; FAM/IBFQ and YAK/IBFQ, were designed for each one of the SNPs. This allelic discrimination assay allows to detect in real time the presence of all type of GES- β-lactamases, being able to differentiate between carbapenemases and extended-spectrum β-lactamase (ESBL), through a quick PCR test that avoid costly sequencing approaches and could help to decrease the current underdiagnosis of minor carbapenemases that scape of phenotypic screenings.";2023;Apr;Journal of microbiological methods;"Pablo-Marcos D; Siller M; Agüero J; Álvarez-Justel A; García-Fernández S; de la Fuente SV; Goicoechea P; Rodríguez-Lozano J; Ocampo-Sosa A; Lucas-Fernández J; Fariñas MC; Fernández J; Fraile-Ribot PA; Aracil B; Oteo-Iglesias J; Calvo-Montes J";"Pablo-Marcos D; Siller M; Agüero J; Álvarez-Justel A; García-Fernández S; de la Fuente SV; Goicoechea P; Rodríguez-Lozano J; Ocampo-Sosa A; Lucas-Fernández J; Fariñas MC; Fernández J; Fraile-Ribot PA; Aracil B; Oteo-Iglesias J; Calvo-Montes J. Are GES carbapenemases underdiagnosed? An allelic discrimination assay for their accurate detection and differentiation.. Journal of microbiological methods. 2023;Apr.";2023-Apr
10.1016/j.resmic.2022.103921;Staphylococcus aureus surface protein G (sasG) allelic variants: correlation between biofilm formation and their prevalence in methicillin-resistant S. aureus (MRSA) clones.;"Methicillin-resistant Staphylococcus aureus (MRSA) may persist for long periods due to biofilm formation. The objective of this study was to describe biofilm formation in association with the presence of S. aureus surface protein G (sasG) and its allelic variants in MRSA bacteraemia isolates from endemic (CC5, CC8, CC22) and sporadic clones in Spain (2008-2015). Crystal violet staining was used to assess biofilm formation; DNA microarray, RT-qPCR, and long-read whole genome sequencing were applied to determine the presence, expression and structure of sasG, respectively. The endemic CC5 and CC8 clones produced more biofilm than the sporadic clones; these endemic clones carried sasG allelic variant 1. Otherwise, sporadic clones, with less biofilm formation, showed either an absence of sasG (65%) or the presence of allelic variant 2 (35%). Variants 1 and 2 differed in the expression of sasG (1.56 ± 1.20 and 0.37 ± 0.32, respectively). The analysis of a large cohort of closed S. aureus genomes available on the NCBI database confirmed the distribution of the two allelic variants with low amino acid identity (68.1%) among endemic and sporadic clones. SasG variant 1 present in the major CC5 and CC8 clones was correlated with increased biofilm formation and may represent an important virulence determinant.";2022;;Research in microbiology;"Carrera-Salinas A; González-Díaz A; Vázquez-Sánchez DA; Camoez M; Niubó J; Càmara J; Ardanuy C; Martí S; Domínguez MÁ";"Carrera-Salinas A; González-Díaz A; Vázquez-Sánchez DA; Camoez M; Niubó J; Càmara J; Ardanuy C; Martí S; Domínguez MÁ. Staphylococcus aureus surface protein G (sasG) allelic variants: correlation between biofilm formation and their prevalence in methicillin-resistant S. aureus (MRSA) clones.. Research in microbiology. 2022;.";2022
10.1016/j.snb.2022.132638;Plasma-induced nanoparticle aggregation for stratifying COVID-19 patients according to disease severity.;Stratifying patients according to disease severity has been a major hurdle during the COVID-19 pandemic. This usually requires evaluating the levels of several biomarkers, which may be cumbersome when rapid decisions are required. In this manuscript we show that a single nanoparticle aggregation test can be used to distinguish patients that require intensive care from those that have already been discharged from the intensive care unit (ICU). It consists of diluting a platelet-free plasma sample and then adding gold nanoparticles. The nanoparticles aggregate to a larger extent when the samples are obtained from a patient in the ICU. This changes the color of the colloidal suspension, which can be evaluated by measuring the pixel intensity of a photograph. Although the exact factor or combination of factors behind the different aggregation behavior is unknown, control experiments demonstrate that the presence of proteins in the samples is crucial for the test to work. Principal component analysis demonstrates that the test result is highly correlated to biomarkers of prognosis and inflammation that are commonly used to evaluate the severity of COVID-19 patients. The results shown here pave the way to develop nanoparticle aggregation assays that classify COVID-19 patients according to disease severity, which could be useful to de-escalate care safely and make a better use of hospital resources.;2022;Dec;Sensors and actuators. B, Chemical;"Santopolo G; Clemente A; González-Freire M; Russell SM; Vaquer A; Barón E; Aranda M; Socias A; Del Castillo A; Borges M; de la Rica R";"Santopolo G; Clemente A; González-Freire M; Russell SM; Vaquer A; Barón E; Aranda M; Socias A; Del Castillo A; Borges M; de la Rica R. Plasma-induced nanoparticle aggregation for stratifying COVID-19 patients according to disease severity.. Sensors and actuators. B, Chemical. 2022;Dec.";2022-Dec
