DOI;Title;Abstract;Year;Month;Journal;Authors;Cite;Pub_Date
10.1128/spectrum.04181-23;In vitro activity of cefiderocol against European Enterobacterales, including isolates resistant to meropenem and recentβ-lactam/β-lactamase inhibitor combinations.;"Carbapenem-resistant Enterobacterales represent a major health threat and have few approved therapeutic options. Enterobacterales isolates were collected from hospitalized inpatients from 49 sites in six European countries (1 January-31 December 2020) and underwent susceptibility testing to cefiderocol and β-lactam/β-lactamase inhibitor combinations. Meropenem-resistant (MIC >8 mg/L) and cefiderocol-susceptible isolates were analyzed by PCR, and cefiderocol-‍resistant isolates by whole-genome sequencing, to identify resistance mechanisms. Overall, 1,909 isolates (including 970 Klebsiella spp., 382 Escherichia coli, and 244 Enterobacter spp.) were collected, commonly from bloodstream infections (43.6%). Cefiderocol susceptibility was higher than approved β-lactam/β-lactamase inhibitor combinations and largely comparable to cefepime-taniborbactam and aztreonam-avibactam against all Enterobacterales (98.1% vs 78.1%-‍97.4% and 98.7%-99.1%, respectively) and Enterobacterales resistant to meropenem (n = 148, including 125 Klebsiella spp.; 87.8% vs 0%-71.6% and 93.2%-98.6%, respectively), β-lactam/β-lactamase inhibitor combinations (66.7%-‍92.1% vs 0%-‍88.1% and 66.7%-97.9%, respectively), and to both meropenem and β-‌lactam/β-lactamase inhibitor combinations (61.9%-65.9% vs 0%-‍20.5% and 76.2%-97.7%, respectively). Susceptibilities to approved and developmental β-lactam/β-lactamase inhibitor combinations against cefiderocol-resistant Enterobacterales (n = 37) were 10.8%-‍56.8% and 78.4%-94.6%, respectively. Most meropenem-resistant Enterobacterales harbored Klebsiella pneumoniae carbapenemase (110/148) genes, although metallo-β-lactamase (35/148) and oxacillinase (OXA) carbapenemase (6/148) genes were less common; cefiderocol susceptibility was retained in β-lactamase producers, other than NDM, AmpC, and non-carbapenemase OXA producers. Most cefiderocol-resistant Enterobacterales had multiple resistance mechanisms, including ≥1 iron uptake-related mutation (37/37), carbapenemase gene (33/37), and ftsI mutation (24/37). The susceptibility to cefiderocol was higher than approved β-lac‌tam/β-lactamase inhibitor combinations against European Enterobacterales, including meropenem- and β-lactam/β-lactamase inhibitor combination-resistant isolates. This study collected a notably large number of Enterobacterales isolates from Europe, including meropenem- and β-lactam/β-lactamase inhibitor combination-resistant isolates against which the in vitro activities of cefiderocol and developmental β-lactam/β-lactamase inhibitor combinations were directly compared for the first time. The MIC breakpoint for high-dose meropenem was used to define meropenem resistance, so isolates that would remain meropenem resistant with doses clinically available to patients were included in the data. Susceptibility to cefiderocol, as a single active compound, was high against Enterobacterales and was higher than or comparable to available β-lactam/β-lactamase inhibitor combinations. These results provide insights into the treatment options for infections due to Enterobacterales with resistant phenotypes. Early susceptibility testing of cefiderocol in parallel with β-lactam/β-lactamase inhibitor combinations will allow patients to receive the most appropriate treatment option(s) available in a timely manner. This is particularly important when options are more limited, such as against metallo-β-lactamase-producing Enterobacterales.";2024;Jun;Microbiology spectrum;"Santerre Henriksen A; Arena F; Attwood M; Canton R; Gatermann S; Naas T; Morrissey I; Longshaw C";"Santerre Henriksen A; Arena F; Attwood M; Canton R; Gatermann S; Naas T; Morrissey I; Longshaw C. In vitro activity of cefiderocol against European Enterobacterales, including isolates resistant to meropenem and recentβ-lactam/β-lactamase inhibitor combinations.. Microbiology spectrum. 2024;Jun.";2024-Jun
10.1186/s12575-022-00181-z;Improved cytometric analysis of untouched lung leukocytes by enzymatic liquefaction of sputum samples.;Phenotyping sputum-resident leukocytes and evaluating their functional status are essential analyses for exploring the cellular basis of pathological processes in the lungs, and flow cytometry is widely recognized as the gold-standard technique to address them. However, sputum-resident leukocytes are found in respiratory samples which need to be liquefied prior to cytometric analysis. Traditional liquefying procedures involve the use of a reducing agent such as dithiothreitol (DTT) in temperature-controlled conditions, which does not homogenize respiratory samples efficiently and impairs cell viability and functionality. Here we propose an enzymatic method that rapidly liquefies samples by means of generating O2 bubbles with endogenous catalase. Sputum specimens from patients with suspected pulmonary infection were treated with DTT, the enzymatic method or PBS. We used turbidimetry to compare the liquefaction degree and cell counts were determined using a hemocytometer. Finally, we conducted a comparative flow cytometry study for evaluating frequencies of sputum-resident neutrophils, eosinophils and lymphocytes and their activation status after liquefaction. Enzymatically treated samples were better liquefied than those treated with DTT or PBS, which resulted in a more accurate cytometric analysis. Frequencies of all cell subsets analyzed within liquefied samples were comparable between liquefaction methods. However, the gentle cell handling rendered by the enzymatic method improves cell viability and retains in vivo functional characteristics of sputum-resident leukocytes (with regard to HLA-DR, CD63 and CD11b expression). In conclusion, the proposed enzymatic liquefaction method improves the cytometric analysis of respiratory samples and leaves the cells widely untouched for properly addressing functional analysis of lung leukocytes.;2022;Nov;Biological procedures online;"Santopolo G; Clemente A; Rojo-Molinero E; Fernández S; Álvarez MC; Oliver A; de la Rica R";"Santopolo G; Clemente A; Rojo-Molinero E; Fernández S; Álvarez MC; Oliver A; de la Rica R. Improved cytometric analysis of untouched lung leukocytes by enzymatic liquefaction of sputum samples.. Biological procedures online. 2022;Nov.";2022-Nov
10.1186/s12955-023-02120-2;Syndemic conditions and quality of life in the PISCIS Cohort of people living with HIV in Catalonia and the Balearic Islands: a cross sectional study.;"People living with HIV (PLWH) face structural and psychosocial factors that affect health-related quality of life (HRQoL). We aimed to evaluate how syndemic conditions affected HRQoL in PLWH. A cross-sectional survey was conducted among 861 PLWH, to determine whether syndemic conditions (monthly income; sexual satisfaction; depressive symptoms; social role satisfaction; social isolation; cognitive function; nicotine dependence; perception of stigma) have an effect on HRQoL. A linear regression model and measures of Additive Interaction (AI) were used to determine the effects of syndemic conditions on HRQoL, controlling for other risk factors. Overall, the most frequently observed were stigma perception (56.9%), poor cognitive function (50.6%) and the perception of social isolation (51.6%). The presence of depressive symptoms was the risk factor most associated with worse Physical Health (PH) (B 3.93, 2.71-5.15) and Mental Health (MH) (B 5.08, 3.81-6.34) in linear regression model. Specifically, an interaction was observed between poor cognitive function and poor satisfaction with social role on worse PH and MH (AI 2.08, 0.14-4.02; AI 2.69, 0.15-5.22, respectively); and low income and perception of stigma (AI 2.98, 0.26-5.71), low income and perception of social isolation (AI 2.79, 0.27-5.32), and low income and poor satisfaction with social role (AI 3.45, 0.99-5.91) on MH. These findings provide evidence that syndemic factors impact HRQoL. HIV prevention programs should screen and address co-occurring health problems to improve patient-centered health care and outcomes.";2023;May;Health and quality of life outcomes;"Mesías-Gazmuri J; Folch C; Palacio-Vieira J; Bruguera A; Egea-Cortés L; Forero CG; Hernández J; Miró JM; Navarro J; Riera M; Peraire J; Alonso-García L; Díaz Y; Casabona J; Reyes-Urueña J";"Mesías-Gazmuri J; Folch C; Palacio-Vieira J; Bruguera A; Egea-Cortés L; Forero CG; Hernández J; Miró JM; Navarro J; Riera M; Peraire J; Alonso-García L; Díaz Y; Casabona J; Reyes-Urueña J. Syndemic conditions and quality of life in the PISCIS Cohort of people living with HIV in Catalonia and the Balearic Islands: a cross sectional study.. Health and quality of life outcomes. 2023;May.";2023-May
10.1371/journal.pone.0277333;Study protocol for a randomized clinical trial to assess 7 versus 14-days of treatment for Pseudomonas aeruginosa bloodstream infections (SHORTEN-2 trial).;"Research priorities in Antimicrobial Stewardship (AMS) have rapidly evolved in the last decade. The need for a more efficient use of antimicrobials have fueled plenty of studies to define the optimal duration for antibiotic treatments, and yet, there still are large areas of uncertainty in common clinical scenarios. Pseudomonas aeruginosa has been pointed as a priority for clinical research, but it has been unattended by most randomized trials tackling the effectiveness of short treatments. The study protocol of the SHORTEN-2 trial is presented as a practical example of new ways to approach common obstacles for clinical research in AMS. To determine whether a 7-day course of antibiotics is superior to 14-day schemes for treating bloodstream infections by P. aeruginosa (BSI-PA). A superiority, open-label, randomized controlled trial will be performed across 30 Spanish hospitals. Adult patients with uncomplicated BSI-PA will be randomized to receive a 7 versus 14-day course of any active antibiotic. The primary endpoint will be the probability for the 7-day group of achieving better outcomes than the control group, assessing altogether clinical effectiveness, severe adverse events, and antibiotic exposure through a DOOR/RADAR analysis. Main secondary endpoints include treatment failure, BSI-PA relapses, and mortality. A superiority design was set for the primary endpoint and non-inferiority for treatment failure, resulting in a sample size of 304 patients. SHORTEN-2 trial aligns with some of the priorities for clinical research in AMS. The implementation of several methodological innovations allowed overcoming common obstacles, like feasible sample sizes or measuring the clinical impact and unintended effects. EudraCt: 2021-003847-10; ClinicalTrials.gov: NCT05210439.";2022;;PloS one;"Molina J; Rosso-Fernández CM; Montero-Mateos E; Paño-Pardo JR; Solla M; Guisado-Gil AB; Álvarez-Marín R; Pachón-Ibáñez ME; Gimeno A; Martín-Gutiérrez G; Lepe JA; Cisneros JM";"Molina J; Rosso-Fernández CM; Montero-Mateos E; Paño-Pardo JR; Solla M; Guisado-Gil AB; Álvarez-Marín R; Pachón-Ibáñez ME; Gimeno A; Martín-Gutiérrez G; Lepe JA; Cisneros JM. Study protocol for a randomized clinical trial to assess 7 versus 14-days of treatment for Pseudomonas aeruginosa bloodstream infections (SHORTEN-2 trial).. PloS one. 2022;.";2022
10.1371/journal.pone.0285917;Reversions of QuantiFERON-TB Gold Plus in tuberculosis contact investigation: A prospective multicentre cohort study.;Interferon-y Release Assays (IGRA) reversions have been reported in different clinical scenarios for the diagnosis of tuberculosis (TB) infection. This study aimed to determine the rate of QuantiFERON-TB Gold Plus (QFT-Plus) reversions during contact investigation as a potential strategy to reduce the number of preventive treatments. Prospective, multicentre cohort study of immunocompetent adult contacts of patients with pulmonary TB tested with QFT-Plus. Contacts with an initial positive QFT-Plus (QFT-i) underwent a second test within 4 weeks (QFT-1), and if negative, underwent a repeat test 4 weeks later (QFT-2). Based on the QFT-2 result, we classified cases as sustained reversion if they remained negative and as temporary reversion if they turned positive. We included 415 contacts, of whom 96 (23.1%) had an initial positive test (QFT-i). Following this, 10 had negative QFT-1 results and 4 (4.2%) of these persisted with a negative result in the QFT-2 (sustained reversions). All four sustained reversions occurred in contacts with IFN-γ concentrations between ≥0.35 and ≤0.99 IU•mL-1 in one or both QFT-i tubes. In this study, TB contact investigations rarely reveal QFT-Plus reversion. These results do not support retesting cases with an initial positive result to reduce the number of preventive treatments.;2023;;PloS one;"Pérez-Recio S; Grijota-Camino MD; Anibarro L; Rabuñal-Rey R; Sabria J; Gijón-Vidaurreta P; Pomar V; García-Gasalla M; Domínguez-Castellano Á; Trigo M; Santos MJ; Cebollero A; Rodríguez S; Moga E; Penas-Truque A; Martos C; Ruiz-Serrano MJ; Garcia-de-Cara EI; Alcaide F; Santin M";"Pérez-Recio S; Grijota-Camino MD; Anibarro L; Rabuñal-Rey R; Sabria J; Gijón-Vidaurreta P; Pomar V; García-Gasalla M; Domínguez-Castellano Á; Trigo M; Santos MJ; Cebollero A; Rodríguez S; Moga E; Penas-Truque A; Martos C; Ruiz-Serrano MJ; Garcia-de-Cara EI; Alcaide F; Santin M. Reversions of QuantiFERON-TB Gold Plus in tuberculosis contact investigation: A prospective multicentre cohort study.. PloS one. 2023;.";2023
10.1371/journal.pone.0308568;Factors associated with SARS-CoV-2 infection among people living with HIV: Data from the Balearic cohort (EVHIA).;The impact of SARS-CoV-2 infection among people living with HIV (PLWH) has been a matter of research. We evaluated the incidence and factors associated with SARS-CoV-2 diagnosis among PLWH. We also assessed factors related to vaccination coverage in the Balearic Islands. A retrospective analytical study was performed, including patients from the Balearic cohort (EVHIA) who were visited at least twice between 1st January 2020 and 31st March 2022. Chi-square test and Mann-Whitney U test were used to compare categorical and continuous variables respectively. Multivariable Cox proportional hazards regression models were estimated to identify risk factors. A total of 3567 patients with HIV were included. The median age was 51 years (IQR 44-59). Most of them were male (77,3%), from Europe (82,1%) or South America (13,8%). During the study period 1036 patients were diagnosed with SARS-CoV-2 infection (29%). The incidence rate was 153,24 cases per 1000 person-year. After multivariable analysis, men who have sex with men (MSM) were associated with an increased risk of SARS-CoV-2 infection (adjusted hazard ratio 1,324, 95% CI 1,138-1,540), whereas African origin, tobacco use and complete or booster vaccination coverage were negatively related. Overall, complete vaccination or booster coverage was recorded in 2845 (79,75%) patients. When analysing vaccination uptake, older patients (adjusted hazard ratio 5,122, 95% CI 3,170-8,288) and those with a modified comorbidity index of 2-3 points (adjusted hazard ratio 1,492, 95% CI 1,056-2,107) had received more vaccine doses. In our study no HIV related factor was associated with an increased risk of SARS-CoV-2 infection, except for differences in the transmission route. Possible confounding variables such as mask wearing or social interactions could not be measured. Vaccines were of utmost importance to prevent SARS-CoV-2 infection. Efforts should be made to encourage vaccination in those groups of PLWH with less coverage.;2024;;PloS one;"Artigues Serra F; Pinecki Socias S; Fanjul FJ; Peñaranda M; Homar F; Sorni P; Serra J; Rey A; Ventayol L; Macia MD; Ribas MÀ; Riera M";"Artigues Serra F; Pinecki Socias S; Fanjul FJ; Peñaranda M; Homar F; Sorni P; Serra J; Rey A; Ventayol L; Macia MD; Ribas MÀ; Riera M. Factors associated with SARS-CoV-2 infection among people living with HIV: Data from the Balearic cohort (EVHIA).. PloS one. 2024;.";2024
10.18176/jiaci.0859;Management of Patients with Suspected or Confirmed Antibiotic Allergy: Executive Summary of Guidelines from the Spanish Society of Infectious Diseases and Clinical Microbiology (SEIMC), the Spanish Society of Allergy and Clinical Immunology (SEAIC), the Spanish Society of Hospital Pharmacy (SEFH) and the Spanish Society of Intensive Medicine and Coronary Care Units (SEMICYUC).;Suspected or confirmed antibiotic allergy is a frequent clinical circumstance that influences antimicrobial prescription and often leads to the avoidable use of less efficacious and/or more toxic or costly drugs than first-line antimicrobials. Optimizing antimicrobial therapy in patients with antibiotic allergy labels has become one of the priorities of antimicrobial stewardship programs in several countries. These guidelines aim to make recommendations for the systematic approach to patients with suspected or confirmed antibiotic allergy based on current evidence. An expert panel (11 members of various scientific societies) formulated questions about the management of patients with suspected or confirmed antibiotic allergy. A systematic literature review was performed by a medical librarian. The questions were distributed among panel members who selected the most relevant references, summarized the evidence, and formulated graded recommendations when possible. The answers to all the questions were finally reviewed by all panel members. A systematic approach to patients with suspected or confirmed antibiotic allergy was recommended to improve antibiotic selection and, consequently, clinical outcomes. A clinically oriented, 3-category risk-stratification strategy was recommended for patients with suspected antibiotic allergy. Complementary assessments should consider both clinical risk category and preferred antibiotic agent. Empirical therapy recommendations for the most relevant clinical syndromes in patients with suspected or confirmed ß-lactam allergy were formulated, as were recommendations on the implementation and monitoring of the impact of the guidelines. Antimicrobial stewardship programs and allergists should design and implement activities that facilitate the most appropriate use of antibiotics in these patients.;2023;Apr;Journal of investigational allergology & clinical immunology;"Paño-Pardo JR; Moreno Rodilla E; Cobo Sacristan S; Cubero Saldaña JL; Periañez Párraga L; Del Pozo León JL; Retamar-Gentil P; Rodríguez Oviedo A; Torres Jaén MJ; Vidal-Cortes P; Colás Sanz C";"Paño-Pardo JR; Moreno Rodilla E; Cobo Sacristan S; Cubero Saldaña JL; Periañez Párraga L; Del Pozo León JL; Retamar-Gentil P; Rodríguez Oviedo A; Torres Jaén MJ; Vidal-Cortes P; Colás Sanz C. Management of Patients with Suspected or Confirmed Antibiotic Allergy: Executive Summary of Guidelines from the Spanish Society of Infectious Diseases and Clinical Microbiology (SEIMC), the Spanish Society of Allergy and Clinical Immunology (SEAIC), the Spanish Society of Hospital Pharmacy (SEFH) and the Spanish Society of Intensive Medicine and Coronary Care Units (SEMICYUC).. Journal of investigational allergology & clinical immunology. 2023;Apr.";2023-Apr
10.3389/fmicb.2021.789731;Multicenter Performance Evaluation of MALDI-TOF MS for Rapid Detection of Carbapenemase Activity in Enterobacterales: The Future of Networking Data Analysis With Online Software.;"In this study, we evaluate the performance of matrix-assisted laser desorption/ionization time-of-flight mass spectrometry (MALDI-TOF MS) for rapid detection of carbapenemase activity in Enterobacterales in clinical microbiology laboratories during a multicenter networking validation study. The study was divided into three different stages: ""software design,"" ""intercenter evaluation,"" and ""clinical validation."" First, a standardized procedure with an online software for data analysis was designed. Carbapenem resistance was detected by measuring imipenem hydrolysis and the results were automatically interpreted using the Clover MS data analysis software (Clover BioSoft, Spain). Second, a series of 74 genotypically characterized Enterobacterales (46 carbapenemase-producers and 28 non carbapenemase-producers) were analyzed in 8 international centers to ensure the reproducibility of the method. Finally, the methodology was evaluated independently in all centers during a 2-month period and results were compared with the reference standard for carbapenemase detection used in each center. The overall agreement rate relative to the reference method for carbapenemase resistance detection in clinical samples was 92.5%. The sensitivity was 93.9% and the specificity, 100%. Results were obtained within 60 min and accuracy ranged from 83.3 to 100% among the different centers. Further, our results demonstrate that MALDI-TOF MS is an outstanding tool for rapid detection of carbapenemase activity in Enterobacterales in clinical microbiology laboratories. The use of a simple in-house procedure with online software allows routine screening of carbapenemases in diagnostics, thereby facilitating early and appropriate antimicrobial therapy.";2021;;Frontiers in microbiology;"Gato E; Anantharajah A; Arroyo MJ; Artacho MJ; Caballero JD; Candela A; Chudějová K; Constanso IP; Elías C; Fernández J; Jiménez J; Lumbreras P; Méndez G; Mulet X; Pérez-Palacios P; Rodríguez-Sánchez B; Cantón R; Hrabák J; Mancera L; Martínez-Martínez L; Oliver A; Pascual Á; Verroken A; Bou G; Oviaño M";"Gato E; Anantharajah A; Arroyo MJ; Artacho MJ; Caballero JD; Candela A; Chudějová K; Constanso IP; Elías C; Fernández J; Jiménez J; Lumbreras P; Méndez G; Mulet X; Pérez-Palacios P; Rodríguez-Sánchez B; Cantón R; Hrabák J; Mancera L; Martínez-Martínez L; Oliver A; Pascual Á; Verroken A; Bou G; Oviaño M. Multicenter Performance Evaluation of MALDI-TOF MS for Rapid Detection of Carbapenemase Activity in Enterobacterales: The Future of Networking Data Analysis With Online Software.. Frontiers in microbiology. 2021;.";2021
10.3389/fmicb.2021.803827;A Genomic Snapshot of the SARS-CoV-2 Pandemic in the Balearic Islands.;"Objective: To analyze the SARS-CoV-2 genomic epidemiology in the Balearic Islands, a unique setting in which the course of the pandemic has been influenced by a complex interplay between insularity, severe social restrictions and tourism travels. Methods: Since the onset of the pandemic, more than 2,700 SARS-CoV-2 positive respiratory samples have been randomly selected and sequenced in the Balearic Islands. Genetic diversity of circulating variants was assessed by lineage assignment of consensus whole genome sequences with PANGOLIN and investigation of additional spike mutations. Results: Consensus sequences were assigned to 46 different PANGO lineages and 75% of genomes were classified within a VOC, VUI, or VUM variant according to the WHO definitions. Highest genetic diversity was documented in the island of Majorca (42 different lineages detected). Globally, lineages B.1.1.7 and B.1.617.2/AY.X were identified as the 2 major lineages circulating in the Balearic Islands during the pandemic, distantly followed by lineages B.1.177/B.1.177.X. However, in Ibiza/Formentera lineage distribution was slightly different and lineage B.1.221 was the third most prevalent. Temporal distribution analysis showed that B.1 and B.1.5 lineages dominated the first epidemic wave, lineage B.1.177 dominated the second and third, and lineage B.1.617.2 the fourth. Of note, lineage B.1.1.7 became the most prevalent circulating lineage during first half of 2021; however, it was not associated with an increased in COVID-19 cases likely due to severe social restrictions and limited travels. Additional spike mutations were rarely documented with the exception of mutation S:Q613H which has been detected in several genomes (n = 25) since July 2021. Conclusion: Virus evolution, mainly driven by the acquisition and selection of spike substitutions conferring biological advantages, social restrictions, and size population are apparently key factors for explaining the epidemic patterns registered in the Balearic Islands.";2021;;Frontiers in microbiology;"López-Causapé C; Fraile-Ribot PA; Jiménez-Serrano S; Cabot G; Del Barrio-Tofiño E; Prado MC; Linares JM; López A; Hurtado A; Riera E; Serra A; Roselló E; Carbó L; Fernández-Baca MV; Gallegos C; Saurina J; Arteaga E; Salom MM; Salvá A; Nicolau A; González-Candelas F; Comas I; Oliver A";"López-Causapé C; Fraile-Ribot PA; Jiménez-Serrano S; Cabot G; Del Barrio-Tofiño E; Prado MC; Linares JM; López A; Hurtado A; Riera E; Serra A; Roselló E; Carbó L; Fernández-Baca MV; Gallegos C; Saurina J; Arteaga E; Salom MM; Salvá A; Nicolau A; González-Candelas F; Comas I; Oliver A. A Genomic Snapshot of the SARS-CoV-2 Pandemic in the Balearic Islands.. Frontiers in microbiology. 2021;.";2021
